[
  {
    "Id": "1",
    "Shape": 1,
    "Width": 32,
    "Length": 32
  },
  {
    "Id": "2",
    "Shape": 1,
    "Width": 25,
    "Length": 25
  },
  {
    "Id": "3",
    "Shape": 1,
    "Width": 0,
    "Length": 0
  },
  {
    "Id": "4",
    "Shape": 1,
    "Width": 40,
    "Length": 40
  },
  {
    "Id": "5",
    "Shape": 1,
    "Width": 50,
    "Length": 50
  },
  {
    "Id": "6",
    "Shape": 1,
    "Width": 60,
    "Length": 60
  },
  {
    "Id": "7",
    "Shape": 1,
    "Width": 92,
    "Length": 120
  },
  {
    "Id": "8",
    "Shape": 1,
    "Width": 28,
    "Length": 28
  },
  {
    "Id": "9",
    "Shape": 1,
    "Width": 42,
    "Length": 75
  },
  {
    "Id": "10",
    "Shape": 1,
    "Width": 70,
    "Length": 105
  },
  {
    "Id": "11",
    "Shape": 1,
    "Width": 109,
    "Length": 170
  },
  {
    "Id": "12",
    "Shape": 1,
    "Width": 100,
    "Length": 100
  },
  {
    "Id": "13",
    "Shape": 1,
    "Width": 160,
    "Length": 160
  },
  {
    "Id": "14",
    "Shape": 1,
    "Width": 130,
    "Length": 130
  },
  {
    "Id": "15",
    "Shape": 1,
    "Width": 35,
    "Length": 60
  },
  {
    "Id": "16",
    "Shape": 1,
    "Width": 80,
    "Length": 80
  },
  {
    "Id": "17",
    "Shape": 1,
    "Width": 65,
    "Length": 65
  },
  {
    "Id": "18",
    "Shape": 1,
    "Width": 120,
    "Length": 92
  },
  {
    "Id": "19",
    "Shape": 1,
    "Width": 28.5,
    "Length": 28.5
  },
  {
    "Id": "20",
    "Shape": 1,
    "Width": 35.5,
    "Length": 60
  },
  {
    "Id": "21",
    "Shape": 1,
    "Width": 90,
    "Length": 90
  },
  {
    "Id": "22",
    "Shape": 1,
    "Width": 52.5,
    "Length": 90
  },
  {
    "Id": "23",
    "Shape": 1,
    "Width": 170,
    "Length": 109
  },
  {
    "Id": "24",
    "Shape": 1,
    "Width": 52,
    "Length": 90
  },
  {
    "Id": "25",
    "Shape": 1,
    "Width": 111,
    "Length": 111
  },
  {
    "Id": "26",
    "Shape": 1,
    "Width": 95,
    "Length": 150
  },
  {
    "Id": "27",
    "Shape": 1,
    "Width": 95,
    "Length": 105
  },
  {
    "Id": "28",
    "Shape": 1,
    "Width": 105,
    "Length": 70
  },
  {
    "Id": "29",
    "Shape": 1,
    "Width": 42,
    "Length": 72
  }
]