[
  {
    "Id": "1",
    "Shape": 0,
    "Width": 25,
    "Length": 25
  },
  {
    "Id": "2",
    "Shape": 0,
    "Width": 50,
    "Length": 100
  },
  {
    "Id": "3",
    "Shape": 0,
    "Width": 40,
    "Length": 40
  },
  {
    "Id": "4",
    "Shape": 0,
    "Width": 25,
    "Length": 50
  },
  {
    "Id": "5",
    "Shape": 0,
    "Width": 20,
    "Length": 20
  },
  {
    "Id": "6",
    "Shape": 0,
    "Width": 50,
    "Length": 50
  },
  {
    "Id": "7",
    "Shape": 0,
    "Width": 50,
    "Length": 75
  },
  {
    "Id": "8",
    "Shape": 0,
    "Width": 150,
    "Length": 100
  },
  {
    "Id": "9",
    "Shape": 0,
    "Width": 60,
    "Length": 100
  },
  {
    "Id": "10",
    "Shape": 0,
    "Width": 40,
    "Length": 60
  },
  {
    "Id": "11",
    "Shape": 0,
    "Width": 60,
    "Length": 60
  },
  {
    "Id": "12",
    "Shape": 0,
    "Width": 100,
    "Length": 100
  },
  {
    "Id": "13",
    "Shape": 0,
    "Width": 40,
    "Length": 20
  },
  {
    "Id": "14",
    "Shape": 0,
    "Width": 100,
    "Length": 150
  },
  {
    "Id": "15",
    "Shape": 0,
    "Width": 75,
    "Length": 75
  },
  {
    "Id": "16",
    "Shape": 0,
    "Width": 40,
    "Length": 80
  },
  {
    "Id": "17",
    "Shape": 0,
    "Width": 75,
    "Length": 100
  },
  {
    "Id": "18",
    "Shape": 0,
    "Width": 60,
    "Length": 40
  },
  {
    "Id": "19",
    "Shape": 0,
    "Width": 100,
    "Length": 200
  },
  {
    "Id": "20",
    "Shape": 0,
    "Width": 75,
    "Length": 50
  },
  {
    "Id": "21",
    "Shape": 0,
    "Width": 80,
    "Length": 80
  }
]